{
  "version": 2,
  "id": "your-scenario-id",
  "title": "Your Scenario Title",
  "meters": {
    "tension": {
      "label": "Tension",
      "min": 0,
      "max": 100,
      "start": 20
    },
    "trust": {
      "label": "Trust",
      "min": 0,
      "max": 100,
      "start": 50
    },
    "childStress": {
      "label": "Child Stress",
      "min": 0,
      "max": 100,
      "start": 10
    }
  },
  "acts": [
    {
      "id": "act-1",
      "title": "Act 1 - Title",
      "start": "n1",
      "nodes": [
        {
          "id": "n1",
          "type": "line",
          "text": "Opening line here.",
          "next": "n2"
        },
        {
          "id": "n2",
          "type": "choice",
          "prompt": "How do you respond?",
          "choices": [
            {
              "label": "Option A",
              "to": "n3",
              "effects": {
                "tension": -5
              }
            },
            {
              "label": "Option B",
              "to": "n3",
              "effects": {
                "tension": 5
              }
            }
          ]
        },
        {
          "id": "n3",
          "type": "line",
          "text": "Closing line.",
          "next": "end"
        },
        {
          "id": "end",
          "type": "end",
          "summary": "Act finished."
        }
      ]
    }
  ]
}