{
  "version": 2,
  "id": "dating-after-breakup",
  "title": "Dating After Breakup",
  "meters": {
    "tension": {
      "label": "Tension",
      "min": 0,
      "max": 100,
      "start": 25
    },
    "trust": {
      "label": "Trust",
      "min": 0,
      "max": 100,
      "start": 50
    },
    "childStress": {
      "label": "Child Stress",
      "min": 0,
      "max": 100,
      "start": 15
    }
  },
  "acts": [
    {
      "id": "act-1",
      "title": "Act 1",
      "start": "a1c1",
      "nodes": [
        {
          "id": "a1c1",
          "type": "choice",
          "prompt": "Choose a path",
          "choices": [
            {
              "label": "\\u2013 The First Step Back into Dating**\\n- **Setting:** A friend invites you to",
              "to": "a1n1"
            }
          ]
        },
        {
          "id": "a1n1",
          "type": "line",
          "speaker": "narrator",
          "text": "\\u2013 The First Step Back into Dating**\\n- **Setting:** A friend invites you to a casua",
          "next": "end"
        },
        {
          "id": "end",
          "type": "end",
          "summary": "End of act."
        }
      ]
    }
  ]
}